{
  "schemaVersion": "0.1",
  "workflowId": "monthly-shipped",
  "name": "月度仓库发货汇总",
  "description": "只统计发货状态为已发货的订单，按仓库代码汇总件数；收款状态不参与判断。",
  "version": 2,
  "status": "TRIAL",
  "createdAt": "2026-09-05T09:42:17.633140+00:00",
  "updatedAt": "2026-09-05T09:57:45.452781+00:00",
  "inputSlots": [
    {
      "slotId": "orders",
      "label": "订单原表",
      "required": true,
      "multiple": false,
      "acceptedExtensions": [
        ".xlsx"
      ],
      "structureFingerprint": {
        "algorithm": "sha256",
        "value": "403c7395f39f8d54e2e11f5d258a8eeeac36be36488888737d6902d32dfba910",
        "basis": "versions/v0002/structure/orders.json"
      }
    }
  ],
  "target": {
    "mode": "GENERATED",
    "outputExtension": ".xlsx",
    "writeScopes": [
      "汇总!A1:B<result-row-count+1>"
    ],
    "protectedScopes": [],
    "preserveUnlistedCells": true
  },
  "implementation": {
    "kind": "SCRIPT",
    "entrypoint": "versions/v0002/run.py",
    "command": [
      "/Users/lch/.cache/codex-runtimes/codex-primary-runtime/dependencies/python/bin/python3",
      "versions/v0002/run.py",
      "--request",
      "{request}"
    ],
    "runtime": "Python 3.12.14 + Node v24.19.0; dependencies.lock.json",
    "artifacts": [
      {
        "path": "versions/v0002/run.py",
        "kind": "SCRIPT",
        "sha256": "5a312c61fcf02f3bd82d4082efc61e349effbecf8e4c7c3ab05701545262dd5d"
      },
      {
        "path": "versions/v0002/render.mjs",
        "kind": "SCRIPT",
        "sha256": "d28b973c780e43cfc3feedf0b7068acc4cfdca236e401b38ecc1928b4d94c21a"
      },
      {
        "path": "versions/v0002/dependencies.lock.json",
        "kind": "DEPENDENCY_LOCK",
        "sha256": "24948a0e3eaa6e9d1bf27d5c53b832053d36539d6ae4b30c52ae7d0016d8dc9e"
      },
      {
        "path": "versions/v0002/structure/orders.json",
        "kind": "STRUCTURE_CONTRACT",
        "sha256": "78b23134e70278124e61672b231f3c8620795199ce8ed11818bab11ccf839fcc"
      },
      {
        "path": "versions/v0002/structure/expected-result.json",
        "kind": "STRUCTURE_CONTRACT",
        "sha256": "479fc8b0c91100775d98c86ff83a336092f5435759e03ab08be86b3f2844d0c5"
      }
    ]
  },
  "parameters": [],
  "validation": {
    "goldCases": [
      {
        "caseId": "historical",
        "storage": "REPLAYABLE",
        "requestPath": "runs/upgrade-v0002/attempt-2/historical.json",
        "expectedResultPath": "/Users/lch/Desktop/project/table-workflows/.table-workflows/behavior-eval-20260905/s2/inbox/我做好的.xlsx",
        "result": "PASS",
        "usedForDiscovery": true,
        "acceptedDifferenceCount": 0,
        "lastRunAt": "2026-09-05T09:57:45.452781+00:00"
      }
    ],
    "invariants": [
      {
        "id": "shipment-only",
        "description": "仅已发货行计入，收款状态不影响结果",
        "severity": "BLOCK"
      },
      {
        "id": "unique-order",
        "description": "订单号缺失或重复时阻断，请人工确认业务口径",
        "severity": "BLOCK"
      },
      {
        "id": "balanced-total",
        "description": "结果件数合计等于已发货行件数合计",
        "severity": "BLOCK"
      },
      {
        "id": "relationship-integrity",
        "description": "关系局部标识可变；关系类型、目标、引用绑定及其他结构必须匹配",
        "severity": "BLOCK"
      }
    ],
    "lastValidatedAt": "2026-09-05T09:57:45.452781+00:00"
  },
  "changeSummary": "修复 Excel 内部关系 Id 变化误报；关系类型、目标及引用绑定保持校验，业务规则不变。历史回放逐格零差异，8 项运行验证通过，保留 v0001。",
  "previousVersion": 1
}
