{
  "schemaVersion": "0.1",
  "workflowId": "synthetic-region-sales",
  "name": "合成区域销售汇总",
  "description": "关联订单与客户源表，仅汇总已完成订单，并生成按销售额降序排列的区域汇总工作簿。",
  "version": 1,
  "status": "TRIAL",
  "createdAt": "2026-09-04T09:32:27Z",
  "updatedAt": "2026-09-04T09:38:05Z",
  "inputSlots": [
    {
      "slotId": "orders-source",
      "label": "订单源表",
      "description": "包含订单号、客户编号、数量、单价和状态的单一工作簿。",
      "required": true,
      "multiple": false,
      "acceptedExtensions": [".xlsx"],
      "structureFingerprint": {
        "algorithm": "sha256",
        "value": "4da470b9d994451b2aa2e5a6235b02d343851751bea0de68d7288364948fa28a",
        "basis": "versions/v0001/structure/orders-input.json"
      }
    },
    {
      "slotId": "customers-source",
      "label": "客户源表",
      "description": "包含唯一客户编号、客户名称和区域的单一工作簿。",
      "required": true,
      "multiple": false,
      "acceptedExtensions": [".xlsx"],
      "structureFingerprint": {
        "algorithm": "sha256",
        "value": "3f062e1f90914f0fa2131df301faaa555448f29885859cc3d24a4cee4ac1364b",
        "basis": "versions/v0001/structure/customers-input.json"
      }
    }
  ],
  "target": {
    "mode": "GENERATED",
    "structureFingerprint": {
      "algorithm": "sha256",
      "value": "bda3be54083447f853569c926f0934302b198522926ac6c00e2553cfecb05fa9",
      "basis": "versions/v0001/structure/target-output.json"
    },
    "outputExtension": ".xlsx",
    "writeScopes": ["区域汇总!A1:D*"],
    "protectedScopes": [],
    "preserveUnlistedCells": true
  },
  "implementation": {
    "kind": "SCRIPT",
    "entrypoint": "versions/v0001/run.mjs",
    "command": [
      "/Users/lch/.cache/codex-runtimes/codex-primary-runtime/dependencies/node/bin/node",
      "versions/v0001/run.mjs",
      "--request",
      "{request}"
    ],
    "runtime": "Bundled Node.js with @oai/artifact-tool; workflow-root node_modules symlink points to the loaded workspace dependencies.",
    "artifacts": [
      {
        "path": "versions/v0001/run.mjs",
        "kind": "SCRIPT",
        "sha256": "47af60fff21bdafe4113f35c99bb5e178ef2b2866fae6cff8f79030fc5f82eea"
      },
      {
        "path": "versions/v0001/structure/orders-input.json",
        "kind": "STRUCTURE_CONTRACT",
        "sha256": "4da470b9d994451b2aa2e5a6235b02d343851751bea0de68d7288364948fa28a"
      },
      {
        "path": "versions/v0001/structure/customers-input.json",
        "kind": "STRUCTURE_CONTRACT",
        "sha256": "3f062e1f90914f0fa2131df301faaa555448f29885859cc3d24a4cee4ac1364b"
      },
      {
        "path": "versions/v0001/structure/target-output.json",
        "kind": "STRUCTURE_CONTRACT",
        "sha256": "bda3be54083447f853569c926f0934302b198522926ac6c00e2553cfecb05fa9"
      }
    ]
  },
  "validation": {
    "goldCases": [
      {
        "caseId": "discovery-001",
        "storage": "REPLAYABLE",
        "requestPath": "runs/operator/request.json",
        "expectedResultPath": "cases/discovery-001/expected/expected.xlsx",
        "result": "PASS",
        "usedForDiscovery": true,
        "lastRunAt": "2026-09-04T09:34:18.598Z",
        "acceptedDifferenceCount": 0
      }
    ],
    "invariants": [
      {
        "id": "unique-orders",
        "description": "订单号必须存在且唯一。",
        "severity": "BLOCK",
        "checker": "versions/v0001/run.mjs:buildSummary"
      },
      {
        "id": "unique-customers",
        "description": "客户编号必须存在且在客户源表中唯一。",
        "severity": "BLOCK",
        "checker": "versions/v0001/run.mjs:buildSummary"
      },
      {
        "id": "valid-numbers",
        "description": "数量和单价必须是非负有限数字。",
        "severity": "BLOCK",
        "checker": "versions/v0001/run.mjs:buildSummary"
      },
      {
        "id": "completed-match",
        "description": "每条已完成订单必须匹配唯一客户和非空区域。",
        "severity": "BLOCK",
        "checker": "versions/v0001/run.mjs:buildSummary"
      },
      {
        "id": "balanced-summary",
        "description": "输出订单数、件数和销售额必须与已完成订单明细平衡。",
        "severity": "BLOCK",
        "checker": "runs/operator/diff-report.json:businessInvariants"
      }
    ],
    "lastValidatedAt": "2026-09-04T09:38:05Z"
  },
  "parameters": [],
  "changeSummary": "v0001 已通过 discovery-001 历史回放；该案例参与规则发现，故状态保持 TRIAL。"
}
