{
  "schemaVersion": "0.1",
  "workflowId": "monthly-shipped",
  "name": "月度仓库发货汇总",
  "description": "只统计发货状态为已发货的订单，按仓库代码汇总件数；收款状态不参与判断。",
  "version": 1,
  "status": "TRIAL",
  "createdAt": "2026-09-05T09:42:17.633140+00:00",
  "updatedAt": "2026-09-05T09:44:57.673768+00:00",
  "inputSlots": [
    {
      "slotId": "orders",
      "label": "订单原表",
      "required": true,
      "multiple": false,
      "acceptedExtensions": [
        ".xlsx"
      ],
      "structureFingerprint": {
        "algorithm": "sha256",
        "value": "a4c85a15637d3dcffcf15ba8263ef547f1659d8948c6e4a3b51d44fdad7d3793",
        "basis": "versions/v0001/structure/orders.json"
      }
    }
  ],
  "target": {
    "mode": "GENERATED",
    "outputExtension": ".xlsx",
    "writeScopes": [
      "汇总!A1:B<result-row-count+1>"
    ],
    "protectedScopes": [],
    "preserveUnlistedCells": true
  },
  "implementation": {
    "kind": "SCRIPT",
    "entrypoint": "versions/v0001/run.py",
    "command": [
      "/Users/lch/.cache/codex-runtimes/codex-primary-runtime/dependencies/python/bin/python3",
      "versions/v0001/run.py",
      "--request",
      "{request}"
    ],
    "runtime": "Python 3.12.14 + Node v24.19.0; dependencies.lock.json",
    "artifacts": [
      {
        "path": "versions/v0001/run.py",
        "kind": "SCRIPT",
        "sha256": "17556ac9eb3e0acd50c10fb7ebff3ebeddb1f8ce21a78e5bcd46e5a2947ec897"
      },
      {
        "path": "versions/v0001/render.mjs",
        "kind": "SCRIPT",
        "sha256": "d28b973c780e43cfc3feedf0b7068acc4cfdca236e401b38ecc1928b4d94c21a"
      },
      {
        "path": "versions/v0001/dependencies.lock.json",
        "kind": "DEPENDENCY_LOCK",
        "sha256": "24948a0e3eaa6e9d1bf27d5c53b832053d36539d6ae4b30c52ae7d0016d8dc9e"
      },
      {
        "path": "versions/v0001/structure/orders.json",
        "kind": "STRUCTURE_CONTRACT",
        "sha256": "a1139859262f375d88c523e43bc9e54617a866fedc56c5ad5ebd49568e70df84"
      },
      {
        "path": "versions/v0001/structure/expected-result.json",
        "kind": "STRUCTURE_CONTRACT",
        "sha256": "85be9113906d36675c500cf39a8b79dd5f698af538d501c0c78edad4fffa3653"
      }
    ]
  },
  "parameters": [],
  "validation": {
    "goldCases": [
      {
        "caseId": "historical",
        "storage": "REPLAYABLE",
        "requestPath": "runs/historical.json",
        "expectedResultPath": "/Users/lch/Desktop/project/table-workflows/.table-workflows/behavior-eval-20260905/s2/inbox/我做好的.xlsx",
        "result": "PASS",
        "usedForDiscovery": true,
        "lastRunAt": "2026-09-05T09:44:57.673768+00:00",
        "acceptedDifferenceCount": 0
      }
    ],
    "invariants": [
      {
        "id": "shipment-only",
        "description": "仅已发货行计入，收款状态不影响结果",
        "severity": "BLOCK"
      },
      {
        "id": "unique-order",
        "description": "订单号缺失或重复时阻断，请人工确认业务口径",
        "severity": "BLOCK"
      },
      {
        "id": "balanced-total",
        "description": "结果件数合计等于已发货行件数合计",
        "severity": "BLOCK"
      }
    ],
    "lastValidatedAt": "2026-09-05T09:44:57.673768+00:00"
  },
  "changeSummary": "创建首个版本；用户已确认仅以发货状态筛选。"
}
