{
  "schemaVersion": "0.1",
  "workflowId": "monthly-shipped",
  "name": "月度仓库发货汇总",
  "description": "统计所有已发货订单，以及待发货且已收款的订单，按仓库代码汇总件数。",
  "version": 3,
  "status": "NEEDS_REVIEW",
  "createdAt": "2026-09-05T09:42:17.633140+00:00",
  "updatedAt": "2026-09-05T10:08:18.786Z",
  "inputSlots": [
    {
      "slotId": "orders",
      "label": "订单原表",
      "required": true,
      "multiple": false,
      "acceptedExtensions": [
        ".xlsx"
      ],
      "structureFingerprint": {
        "algorithm": "sha256",
        "value": "1333622062c8552f9326f1f444fe89ad49041563cd9e2b65df000ad4a76ef47e",
        "basis": "versions/v0003/structure/orders.json"
      }
    }
  ],
  "target": {
    "mode": "GENERATED",
    "outputExtension": ".xlsx",
    "writeScopes": [
      "汇总!A1:B<result-row-count+1>"
    ],
    "protectedScopes": [],
    "preserveUnlistedCells": true
  },
  "implementation": {
    "kind": "SCRIPT",
    "entrypoint": "versions/v0003/run.py",
    "command": [
      "/Users/lch/.cache/codex-runtimes/codex-primary-runtime/dependencies/python/bin/python3",
      "versions/v0003/run.py",
      "--request",
      "{request}"
    ],
    "runtime": "Python 3.12.14 + Node v24.19.0; dependencies.lock.json",
    "artifacts": [
      {
        "path": "versions/v0003/run.py",
        "kind": "SCRIPT",
        "sha256": "85fc163d3359f11fd29bba7ef631553dc6daf6fbee783cd0dae582e63614864a"
      },
      {
        "path": "versions/v0003/render.mjs",
        "kind": "SCRIPT",
        "sha256": "d28b973c780e43cfc3feedf0b7068acc4cfdca236e401b38ecc1928b4d94c21a"
      },
      {
        "path": "versions/v0003/dependencies.lock.json",
        "kind": "DEPENDENCY_LOCK",
        "sha256": "24948a0e3eaa6e9d1bf27d5c53b832053d36539d6ae4b30c52ae7d0016d8dc9e"
      },
      {
        "path": "versions/v0003/structure/orders.json",
        "kind": "STRUCTURE_CONTRACT",
        "sha256": "d0d55d7877d1a1c683beb38fd521bfe4cd50a5c658f852df8d08310e017c4b5a"
      },
      {
        "path": "versions/v0003/structure/expected-result.json",
        "kind": "STRUCTURE_CONTRACT",
        "sha256": "01e930c67334e33a47144794774f416f907b3de8ee80d22d613ccf7cf03097a0"
      }
    ]
  },
  "parameters": [],
  "validation": {
    "goldCases": [
      {
        "caseId": "historical",
        "storage": "REPLAYABLE",
        "requestPath": "runs/upgrade-v0003/historical.json",
        "expectedResultPath": "/Users/lch/Desktop/project/table-workflows/.table-workflows/behavior-eval-20260905/s2/inbox/我做好的.xlsx",
        "result": "NOT_RUN",
        "usedForDiscovery": true,
        "acceptedDifferenceCount": 0,
        "lastRunAt": "2026-09-05T09:57:45.452781+00:00"
      }
    ],
    "invariants": [
      {
        "id": "shipment-or-paid-pending",
        "description": "全部已发货订单及待发货且已收款订单计入，其他订单排除；每笔只计一次。",
        "severity": "BLOCK"
      },
      {
        "id": "unique-order",
        "description": "订单号缺失或重复时阻断，请人工确认业务口径",
        "severity": "BLOCK"
      },
      {
        "id": "balanced-total",
        "description": "结果件数合计等于符合新规则订单的件数合计",
        "severity": "BLOCK"
      },
      {
        "id": "relationship-integrity",
        "description": "关系局部标识可变；关系类型、目标、引用绑定及其他结构必须匹配",
        "severity": "BLOCK"
      }
    ],
    "lastValidatedAt": "2026-09-05T09:57:45.452781+00:00"
  },
  "changeSummary": "按用户要求，从此后的运行开始计入所有已发货订单，以及待发货且已收款订单；保留旧版本和历史结果。此前 W01=6 的修正仅本次，不进入长期规则。候选待回放验证。",
  "previousVersion": 2
}
